{
  "$schema": "https://cmdk.email/schema/gmail-shortcuts-v1.json",
  "version": "1.0.0",
  "generated": "2026-08-17",
  "source": "https://github.com/SimplehumanEml/gmail-shortcuts",
  "license": "CC-BY-4.0",
  "counts": {
    "total": 95,
    "gmailNative": 59,
    "cmdk": 36
  },
  "shortcuts": [
    {
      "id": "gmail-learn-these-ten-first-c",
      "keys": {
        "default": "c"
      },
      "action": "Compose",
      "description": "Compose",
      "category": "learn-these-ten-first",
      "categoryLabel": "Learn these ten first",
      "origin": "gmail-native",
      "requiresSetting": "Keyboard shortcuts turned on in Gmail settings"
    },
    {
      "id": "gmail-learn-these-ten-first-e",
      "keys": {
        "default": "e"
      },
      "action": "Archive",
      "description": "Archive",
      "category": "learn-these-ten-first",
      "categoryLabel": "Learn these ten first",
      "origin": "gmail-native",
      "requiresSetting": "Keyboard shortcuts turned on in Gmail settings"
    },
    {
      "id": "gmail-learn-these-ten-first-key",
      "keys": {
        "default": "#"
      },
      "action": "Delete",
      "description": "Delete",
      "category": "learn-these-ten-first",
      "categoryLabel": "Learn these ten first",
      "origin": "gmail-native",
      "requiresSetting": "Keyboard shortcuts turned on in Gmail settings"
    },
    {
      "id": "gmail-learn-these-ten-first-r",
      "keys": {
        "default": "r"
      },
      "action": "Reply",
      "description": "Reply",
      "category": "learn-these-ten-first",
      "categoryLabel": "Learn these ten first",
      "origin": "gmail-native",
      "requiresSetting": "Keyboard shortcuts turned on in Gmail settings"
    },
    {
      "id": "gmail-learn-these-ten-first-a",
      "keys": {
        "default": "a"
      },
      "action": "Reply all",
      "description": "Reply all",
      "category": "learn-these-ten-first",
      "categoryLabel": "Learn these ten first",
      "origin": "gmail-native",
      "requiresSetting": "Keyboard shortcuts turned on in Gmail settings"
    },
    {
      "id": "gmail-learn-these-ten-first-j-k",
      "keys": {
        "default": "j / k"
      },
      "action": "Older / newer conversation",
      "description": "Older / newer conversation",
      "category": "learn-these-ten-first",
      "categoryLabel": "Learn these ten first",
      "origin": "gmail-native",
      "requiresSetting": "Keyboard shortcuts turned on in Gmail settings"
    },
    {
      "id": "gmail-learn-these-ten-first-o",
      "keys": {
        "default": "o"
      },
      "action": "Open conversation (or Enter)",
      "description": "Open conversation (or Enter)",
      "category": "learn-these-ten-first",
      "categoryLabel": "Learn these ten first",
      "origin": "gmail-native",
      "requiresSetting": "Keyboard shortcuts turned on in Gmail settings"
    },
    {
      "id": "gmail-learn-these-ten-first-u",
      "keys": {
        "default": "u"
      },
      "action": "Back to list",
      "description": "Back to list",
      "category": "learn-these-ten-first",
      "categoryLabel": "Learn these ten first",
      "origin": "gmail-native",
      "requiresSetting": "Keyboard shortcuts turned on in Gmail settings"
    },
    {
      "id": "gmail-learn-these-ten-first-key",
      "keys": {
        "default": "/"
      },
      "action": "Search",
      "description": "Search",
      "category": "learn-these-ten-first",
      "categoryLabel": "Learn these ten first",
      "origin": "gmail-native",
      "requiresSetting": "Keyboard shortcuts turned on in Gmail settings"
    },
    {
      "id": "gmail-learn-these-ten-first-z",
      "keys": {
        "default": "z"
      },
      "action": "Undo last action",
      "description": "Undo last action",
      "category": "learn-these-ten-first",
      "categoryLabel": "Learn these ten first",
      "origin": "gmail-native",
      "requiresSetting": "Keyboard shortcuts turned on in Gmail settings"
    },
    {
      "id": "gmail-navigation-n-p",
      "keys": {
        "default": "n / p"
      },
      "action": "Next / previous message in thread",
      "description": "Next / previous message in thread",
      "category": "navigation",
      "categoryLabel": "Navigation",
      "origin": "gmail-native",
      "requiresSetting": "Keyboard shortcuts turned on in Gmail settings"
    },
    {
      "id": "gmail-navigation-key",
      "keys": {
        "default": "`"
      },
      "action": "Next inbox tab",
      "description": "Next inbox tab",
      "category": "navigation",
      "categoryLabel": "Navigation",
      "origin": "gmail-native",
      "requiresSetting": "Keyboard shortcuts turned on in Gmail settings"
    },
    {
      "id": "gmail-navigation-key",
      "keys": {
        "default": "~"
      },
      "action": "Previous inbox tab",
      "description": "Previous inbox tab",
      "category": "navigation",
      "categoryLabel": "Navigation",
      "origin": "gmail-native",
      "requiresSetting": "Keyboard shortcuts turned on in Gmail settings"
    },
    {
      "id": "gmail-navigation-key",
      "keys": {
        "default": "?"
      },
      "action": "Shortcut help overlay",
      "description": "Shortcut help overlay",
      "category": "navigation",
      "categoryLabel": "Navigation",
      "origin": "gmail-native",
      "requiresSetting": "Keyboard shortcuts turned on in Gmail settings"
    },
    {
      "id": "gmail-navigation-esc",
      "keys": {
        "default": "Esc"
      },
      "action": "Leave input field",
      "description": "Leave input field",
      "category": "navigation",
      "categoryLabel": "Navigation",
      "origin": "gmail-native",
      "requiresSetting": "Keyboard shortcuts turned on in Gmail settings"
    },
    {
      "id": "gmail-go-to-g-i",
      "keys": {
        "default": "g i"
      },
      "action": "Inbox",
      "description": "Inbox",
      "category": "go-to",
      "categoryLabel": "Go to",
      "origin": "gmail-native",
      "requiresSetting": "Keyboard shortcuts turned on in Gmail settings"
    },
    {
      "id": "gmail-go-to-g-s",
      "keys": {
        "default": "g s"
      },
      "action": "Starred",
      "description": "Starred",
      "category": "go-to",
      "categoryLabel": "Go to",
      "origin": "gmail-native",
      "requiresSetting": "Keyboard shortcuts turned on in Gmail settings"
    },
    {
      "id": "gmail-go-to-g-t",
      "keys": {
        "default": "g t"
      },
      "action": "Sent",
      "description": "Sent",
      "category": "go-to",
      "categoryLabel": "Go to",
      "origin": "gmail-native",
      "requiresSetting": "Keyboard shortcuts turned on in Gmail settings"
    },
    {
      "id": "gmail-go-to-g-d",
      "keys": {
        "default": "g d"
      },
      "action": "Drafts",
      "description": "Drafts",
      "category": "go-to",
      "categoryLabel": "Go to",
      "origin": "gmail-native",
      "requiresSetting": "Keyboard shortcuts turned on in Gmail settings"
    },
    {
      "id": "gmail-go-to-g-a",
      "keys": {
        "default": "g a"
      },
      "action": "All Mail",
      "description": "All Mail",
      "category": "go-to",
      "categoryLabel": "Go to",
      "origin": "gmail-native",
      "requiresSetting": "Keyboard shortcuts turned on in Gmail settings"
    },
    {
      "id": "gmail-go-to-g-k",
      "keys": {
        "default": "g k"
      },
      "action": "Tasks",
      "description": "Tasks",
      "category": "go-to",
      "categoryLabel": "Go to",
      "origin": "gmail-native",
      "requiresSetting": "Keyboard shortcuts turned on in Gmail settings"
    },
    {
      "id": "gmail-go-to-g-c",
      "keys": {
        "default": "g c"
      },
      "action": "Contacts",
      "description": "Contacts",
      "category": "go-to",
      "categoryLabel": "Go to",
      "origin": "gmail-native",
      "requiresSetting": "Keyboard shortcuts turned on in Gmail settings"
    },
    {
      "id": "gmail-go-to-g-n",
      "keys": {
        "default": "g n"
      },
      "action": "Next page of list",
      "description": "Next page of list",
      "category": "go-to",
      "categoryLabel": "Go to",
      "origin": "gmail-native",
      "requiresSetting": "Keyboard shortcuts turned on in Gmail settings"
    },
    {
      "id": "gmail-go-to-g-p",
      "keys": {
        "default": "g p"
      },
      "action": "Previous page of list",
      "description": "Previous page of list",
      "category": "go-to",
      "categoryLabel": "Go to",
      "origin": "gmail-native",
      "requiresSetting": "Keyboard shortcuts turned on in Gmail settings"
    },
    {
      "id": "gmail-reply-forward-f",
      "keys": {
        "default": "f"
      },
      "action": "Forward",
      "description": "Forward",
      "category": "reply-forward",
      "categoryLabel": "Reply & forward",
      "origin": "gmail-native",
      "requiresSetting": "Keyboard shortcuts turned on in Gmail settings"
    },
    {
      "id": "gmail-reply-forward-r",
      "keys": {
        "default": "⇧r"
      },
      "action": "Reply in new window",
      "description": "Reply in new window",
      "category": "reply-forward",
      "categoryLabel": "Reply & forward",
      "origin": "gmail-native",
      "requiresSetting": "Keyboard shortcuts turned on in Gmail settings"
    },
    {
      "id": "gmail-reply-forward-a",
      "keys": {
        "default": "⇧a"
      },
      "action": "Reply all in new window",
      "description": "Reply all in new window",
      "category": "reply-forward",
      "categoryLabel": "Reply & forward",
      "origin": "gmail-native",
      "requiresSetting": "Keyboard shortcuts turned on in Gmail settings"
    },
    {
      "id": "gmail-reply-forward-f",
      "keys": {
        "default": "⇧f"
      },
      "action": "Forward in new window",
      "description": "Forward in new window",